{
  "$schema": "https://json-schema.org/draft/2020-12/schema",
  "$id": "risk_behavior_auditor_request.schema.json",
  "title": "RiskBehaviorAuditorRequest",
  "type": "object",
  "required": [
    "task_context",
    "meeting_id",
    "project_id",
    "manager_id",
    "manager_name",
    "planner_slice",
    "current_meeting",
    "risk_context",
    "behavior_context",
    "hard_metrics",
    "metric_quality_report",
    "anomaly_samples"
  ],
  "properties": {
    "task_context": { "type": "object" },
    "meeting_id": { "type": "string" },
    "project_id": { "type": "string" },
    "manager_id": { "type": "string" },
    "manager_name": { "type": "string" },
    "planner_slice": { "type": "object" },
    "current_meeting": { "type": "object" },
    "risk_context": { "type": "object" },
    "behavior_context": { "type": "object" },
    "hard_metrics": {
      "type": "array",
      "items": { "type": "object" }
    },
    "metric_quality_report": { "type": "object" },
    "anomaly_samples": {
      "type": "array",
      "items": { "type": "object" }
    }
  },
  "additionalProperties": false
}
