{
  "task_context": {
    "task_id": "FRONT-PJT-CASE-05-MTG-CASE-05-03",
    "project_id": "PJT-CASE-05",
    "manager_id": "MGR-CASE-05",
    "meeting_id": "MTG-CASE-05-03",
    "evaluation_period": "2026-01-01 ~ 2026-04-24",
    "status": "collected",
    "created_at": "2026-05-06T08:42:22.627Z",
    "updated_at": "2026-05-06T08:42:22.627Z"
  },
  "meeting_id": "MTG-CASE-05-03",
  "project_id": "PJT-CASE-05",
  "manager_id": "MGR-CASE-05",
  "manager_name": "周牧",
  "planner_slice": {
    "focus_dimensions": [
      {
        "dimension": "风险治理力",
        "priority": "high",
        "reasons": [
          "风险未收口占比为 1，需要重点检查高等级风险和遗留风险治理。",
          "高等级风险收口率为 0，需要复核未收口高风险的缓释动作。"
        ]
      },
      {
        "dimension": "组织行为健康度",
        "priority": "high",
        "reasons": [
          "高压推进语言样本占比为 0.04，只生成观察项并进入人工复核。",
          "当前输入存在补录、噪音或上下文不足，组织行为判断必须降低置信度。"
        ]
      }
    ],
    "assigned_plan": {
      "agent_name": "Risk & Behavior Auditor",
      "required": true,
      "input_keys": [
        "meeting_fact_pack",
        "history_bundle",
        "hard_metrics_result",
        "raw_payload"
      ],
      "output_keys": [
        "dimension_findings",
        "risk_flags",
        "human_review_items"
      ],
      "focus_dimensions": [
        "风险治理力",
        "组织行为健康度"
      ]
    },
    "human_review_rules": [
      {
        "rule_id": "review_missing_current_transcript",
        "severity": "medium",
        "reason": "当前会议缺完整妙记转写，关键语义判断需人工确认上下文。",
        "target_nodes": [
          "Management Reviewer",
          "Risk & Behavior Auditor"
        ]
      },
      {
        "rule_id": "review_behavior_language_context",
        "severity": "medium",
        "reason": "组织行为相关语言只能作为观察项，需人工确认语境和场景。",
        "target_nodes": [
          "Risk & Behavior Auditor",
          "Capability Assessor"
        ]
      },
      {
        "rule_id": "review_unresolved_high_risks",
        "severity": "high",
        "reason": "高等级风险未完全收口，风险治理结论需人工复核。",
        "target_nodes": [
          "Risk & Behavior Auditor"
        ]
      }
    ]
  },
  "current_meeting": {
    "meeting_info": {
      "meeting_id": "MTG-CASE-05-03",
      "project_id": "PJT-CASE-05",
      "manager_id": "MGR-CASE-05",
      "manager_name": "周牧",
      "meeting_title": "供应链风险应急沟通",
      "meeting_time": "2026-04-24 09:00 - 09:45",
      "participants": [
        "周牧",
        "林峰"
      ],
      "calendar_event_id": "cal_case05_evt_0424_emergency",
      "review_status": "补录摘要"
    },
    "risks_mentioned": [
      "供应商产能瓶颈",
      "备选方案精度不足",
      "模具T0节点可能延后"
    ],
    "decisions": [
      "协调供应链总监争取插队",
      "同步评估供应商C打样能力",
      "周牧单独跟进不占用群资源"
    ],
    "noise_signals": [],
    "missing_fields": [
      "meeting_docs.current_transcript"
    ],
    "provenance_refs": [
      {
        "source_type": "base_record",
        "source_file": "03_task_risk_register/base_projects_record_list.json",
        "source_id": "PJT-CASE-05",
        "timestamp": "2026-01-01",
        "excerpt": "2026年度智能家居产品线工业设计"
      },
      {
        "source_type": "base_record",
        "source_file": "04_meetings/base_meetings_record_list.json",
        "source_id": "MTG-CASE-05-03",
        "timestamp": "2026-04-24 09:00 - 09:45",
        "excerpt": "供应链风险应急沟通"
      },
      {
        "source_type": "statement",
        "source_file": "04_meetings/base_statements_record_list.json",
        "source_id": "MTG-CASE-05-03-STM-1",
        "timestamp": "MTG-CASE-05-03",
        "excerpt": "已经让法务在看了，初步判断有规避空间，但需要调整底部轮廓线。"
      },
      {
        "source_type": "statement",
        "source_file": "04_meetings/base_statements_record_list.json",
        "source_id": "MTG-CASE-05-03-STM-2",
        "timestamp": "MTG-CASE-05-03",
        "excerpt": "先不在群里说了，我单独找供应链总监协调，看看能不能插队。"
      },
      {
        "source_type": "chat",
        "source_file": "02_chats/im_messages_search_user.json",
        "source_id": "om_case05msg0002",
        "timestamp": "2026-04-01 09:15",
        "excerpt": "4月项目启动，本周重点是完成智能音箱和扫地机器人的概念设计评审。"
      },
      {
        "source_type": "chat",
        "source_file": "02_chats/im_messages_search_user.json",
        "source_id": "om_case05msg0003",
        "timestamp": "2026-04-01 09:20",
        "excerpt": "概念设计稿我已经发到云文档了，大家看一下有没有问题。"
      },
      {
        "source_type": "chat",
        "source_file": "02_chats/im_messages_search_user.json",
        "source_id": "om_case05msg0005",
        "timestamp": "2026-04-01 10:35",
        "excerpt": "收到，我调整一下底部轮廓线，增加差异化。"
      },
      {
        "source_type": "chat",
        "source_file": "02_chats/im_messages_search_user.json",
        "source_id": "om_case05msg0007",
        "timestamp": "2026-04-02 14:05",
        "excerpt": "我和声学团队确认一下，如果影响比较大就调整散热孔位置。"
      },
      {
        "source_type": "calendar",
        "source_file": "06_calendar/calendar_events_instance_view.json",
        "source_id": "cal_case05_evt_0424_emergency",
        "timestamp": "2026-04-24T09:00:00+08:00",
        "excerpt": "供应链风险应急沟通"
      }
    ]
  },
  "risk_context": {
    "open_risks": [
      {
        "id": "NO.601",
        "followup_status": "open",
        "meeting_id": "MTG-CASE-05-02",
        "trigger_reason": "设计曲面过于复杂，超出供应商当前工艺能力",
        "risk_description": "供应商A模具曲面壁厚不均，需返工3处，可能延误T0节点",
        "risk_level": "high",
        "project_id": "PJT-CASE-05",
        "suggested_action": "同步调整拔模角度压缩返工周期至4天",
        "risk_type": "供应链"
      },
      {
        "id": "NO.602",
        "followup_status": "open",
        "meeting_id": "MTG-CASE-05-01",
        "trigger_reason": "安全认证部门新增指纹识别模块防水要求",
        "risk_description": "智能门锁防水等级从IPX4提升至IPX6，外观开口需重新设计",
        "risk_level": "high",
        "project_id": "PJT-CASE-05",
        "suggested_action": "评估密封圈+导流槽组合方案，5月5日前输出新方案",
        "risk_type": "认证变更"
      },
      {
        "id": "NO.603",
        "followup_status": "open",
        "meeting_id": "MTG-CASE-05-03",
        "trigger_reason": "竞品提前发布，设计相似度较高",
        "risk_description": "竞品发布相似外观方案，存在专利侵权风险",
        "risk_level": "medium",
        "project_id": "PJT-CASE-05",
        "suggested_action": "法务评估规避空间，调整底部轮廓线差异化设计",
        "risk_type": "知识产权"
      },
      {
        "id": "NO.604",
        "followup_status": "open",
        "meeting_id": "MTG-CASE-05-03",
        "trigger_reason": "供应商订单过载，备选供应商精度不达标",
        "risk_description": "核心注塑供应商Q2产能饱和，模具排期可能延后10天",
        "risk_level": "medium",
        "project_id": "PJT-CASE-05",
        "suggested_action": "协调供应链总监争取插队，同步评估供应商C打样能力",
        "risk_type": "供应链"
      },
      {
        "id": "NO.605",
        "followup_status": "tracking",
        "meeting_id": "MTG-CASE-05-02",
        "trigger_reason": "复杂曲面需要多轴加工，制造成本增加",
        "risk_description": "ID曲面导致模具成本上升15%",
        "risk_level": "low",
        "project_id": "PJT-CASE-05",
        "suggested_action": "设计效果优先，预算问题单独与财务沟通",
        "risk_type": "成本"
      }
    ],
    "all_risks": [
      {
        "id": "NO.601",
        "followup_status": "open",
        "meeting_id": "MTG-CASE-05-02",
        "trigger_reason": "设计曲面过于复杂，超出供应商当前工艺能力",
        "risk_description": "供应商A模具曲面壁厚不均，需返工3处，可能延误T0节点",
        "risk_level": "high",
        "project_id": "PJT-CASE-05",
        "suggested_action": "同步调整拔模角度压缩返工周期至4天",
        "risk_type": "供应链"
      },
      {
        "id": "NO.602",
        "followup_status": "open",
        "meeting_id": "MTG-CASE-05-01",
        "trigger_reason": "安全认证部门新增指纹识别模块防水要求",
        "risk_description": "智能门锁防水等级从IPX4提升至IPX6，外观开口需重新设计",
        "risk_level": "high",
        "project_id": "PJT-CASE-05",
        "suggested_action": "评估密封圈+导流槽组合方案，5月5日前输出新方案",
        "risk_type": "认证变更"
      },
      {
        "id": "NO.603",
        "followup_status": "open",
        "meeting_id": "MTG-CASE-05-03",
        "trigger_reason": "竞品提前发布，设计相似度较高",
        "risk_description": "竞品发布相似外观方案，存在专利侵权风险",
        "risk_level": "medium",
        "project_id": "PJT-CASE-05",
        "suggested_action": "法务评估规避空间，调整底部轮廓线差异化设计",
        "risk_type": "知识产权"
      },
      {
        "id": "NO.604",
        "followup_status": "open",
        "meeting_id": "MTG-CASE-05-03",
        "trigger_reason": "供应商订单过载，备选供应商精度不达标",
        "risk_description": "核心注塑供应商Q2产能饱和，模具排期可能延后10天",
        "risk_level": "medium",
        "project_id": "PJT-CASE-05",
        "suggested_action": "协调供应链总监争取插队，同步评估供应商C打样能力",
        "risk_type": "供应链"
      },
      {
        "id": "NO.605",
        "followup_status": "tracking",
        "meeting_id": "MTG-CASE-05-02",
        "trigger_reason": "复杂曲面需要多轴加工，制造成本增加",
        "risk_description": "ID曲面导致模具成本上升15%",
        "risk_level": "low",
        "project_id": "PJT-CASE-05",
        "suggested_action": "设计效果优先，预算问题单独与财务沟通",
        "risk_type": "成本"
      }
    ],
    "risk_history": [
      {
        "record_id": "reccase05task001",
        "task_id": "PJT-CASE-05-TASK-01",
        "risk_id": "",
        "field_changes": [
          {
            "field": "status",
            "old_value": "待开始",
            "new_value": "进行中",
            "operator": {
              "open_id": "ou_case05zhoumutarget001",
              "name": "周牧"
            },
            "update_time": "2026-04-02 09:15"
          },
          {
            "field": "status",
            "old_value": "进行中",
            "new_value": "已完成",
            "operator": {
              "open_id": "ou_case05zhoumutarget001",
              "name": "周牧"
            },
            "update_time": "2026-04-05 17:30"
          }
        ]
      },
      {
        "record_id": "reccase05task002",
        "task_id": "PJT-CASE-05-TASK-02",
        "risk_id": "",
        "field_changes": [
          {
            "field": "status",
            "old_value": "待开始",
            "new_value": "进行中",
            "operator": {
              "open_id": "ou_case05zhoumutarget001",
              "name": "周牧"
            },
            "update_time": "2026-04-02 09:15"
          },